,Text
282,"There are two main limitations of our work. Firstly, since there are no known baselines for Indian language DC except Kundu et al. (2022), other architectures might perform better than our model. Our claim that Seq-GAN-BERT tries to maximize the information gained from unlabeled sentences is supported by superior performance over baselines defined in this work and other related models. Secondly, due to the lack of good quality labeled datasets, our test sets contained only 100 sentences. However, we believe that the consistency of our high-performing models across languages and multiple seeded experiments presents a positive sign for DC in low-resource settings."
283,Limitations have been mentioned as section 8 of the paper submitted
284,"This work puts forth a position: by the nature of a position paper, the work is deliberately intended to be evocative and opinionated, in some places not having unequivocal evidence for certain claims. This presents a clear limitation: the analysis presented may diverge from the realities of NLP at present or in the future, namely if the assumptions/conditions presented themselves prove to be untrue in practice. Nonetheless, we believe centering power and change, and understanding evaluation as a political and sociological phenomenon, is likely to be useful under all conditions.
Further, in understanding the qualities of evaluation relative to other social forces, we directly suggest that evaluation is more readily operationalized in more pluralistic ways than other key forces (primarily resources). While initial efforts indicate the potential for such holistic approaches that reflect many different desiderata (Liang et al., 2022b) as well as participatory approaches that permit contribution from different entities (e.g. Srivastava et al., 2022), it is still unclear how much adoption such approaches will get, and therefore how much power they will acquire. That is, the extent to which evaluation can realize this pluralistic vision still largely remains an unresolved aspiration than a readily realizable certainty. And, conversely, we do note that while current practices potentially put pluralism and resources at odds, they may be mutually compatible in other regimes (e.g. decentralized training through the pooling of shared/volunteered compute (Yuan et al., 2022), open-source software development (Wolf et al., 2020; Gao et al., 2021; von Werra et al., 2022)).
Finally, we do not discuss other forces that we believe have not exhibited strong influence on NLP research thus far, in favor of allocating focus to evaluation and resources, which have had clear influence. To enumerate some of these other (potential) forces, we specifically note (i) research norms, (ii) policy and regulation, and (iii) auditing/advocacy. For (i), we note that while the NLP research community has many established norms (e.g. reproducibility checklists, peer review guidelines, conference organization structure, policies on respectful conduct), most of these do not directly/significantly influence what research topics different researchers work on. We do note that is possible in the future that certain norms (e.g. the access to training data or model checkpoints;
Liang et al., 2022a) would influence what research is conducted (e.g. we may have not seen as much work on the learning dynamics of language models and/or memorization of training data due to the relative inaccessibility of intermediary checkpoints and training data until recently). For (ii), we note that policy and regulatory efforts have had little to no salient impact on the deployment of most language technologies, let alone NLP research, to our knowledge. With that said, much as efforts like GDPR and privacy legislation has impacted scientific research on privacy (e.g. work that operationalizes the right to be forgotten as in Ginart et al., 2019), similar trends could occur in NLP research (e.g. in response to the EU AI Act).3 Akin to (ii), for (iii), we also have seen fairly little impact from auditing/advocacy work on NLP research to our knowledge. But, much as work on auditing/advocacy around face recognition (Buolamwini and Gebru, 2018; Raji and Buolamwini, 2019; Raji et al., 2020, inter alia) influenced research in the computer vision community, we could see similar trends in NLP (e.g. in response to auditing/advocacy intervention around language models)."
285,Limitations (pg 5)
286,"First, despite our pursuit of attempting to understand figurative language use across cultures, we have barely scratched the surface in terms of diverse representation. Due to limited scope, budget, and resources, we collect data from 2-3 annotators per language, for seven languages. Further, culture can vary greatly within a language (Hershcovich et al., 2022). Therefore, until we can represent all of the worlds’ people and their languages, there will always be room for improvement. We also acknowledge that the syntax captured in the dataset may not be the most diverse, as many examples follow the template “<X> is like <Y>”. However, we create these simpler examples as a first step, since extension to more complex and naturalistic language can be included in future work. Second, to analyse concept shift, we machine translate test sets into English. However, these translations can be erroneous to varying degrees, which may have resulted in an over-estimation of error attribution to concept shift. This could not be avoided however, due to limited resources of obtaining human translations. Third, English may not be the best language to transfer from in zero-shot evaluation of multilingual models. While we were constrained by training data availability, past works have shown that
machine-translating train sets can help, an avenue we haven’t explored here. Even though we experiment with few-shot evaluation, there may exist an optimal combination of source languages which best transfer to our target languages. Fourth, the English authors recognized culturespecific terms that were not marked as cultural by annotators in the commonsense categorization across all languages. This may be because annotators, being mostly familiar with their own cultures, attributed culturally specific facts and terms as being common sense. Likewise, the Englishspeaking participants may have viewed a separate set of facts as common sense which would not be agreed upon by people from a different culture. It is thus difficult to disentangle common sense and culture in many cases."
287,"Our approach requires training a discriminator with an attribute classification dataset, which may be expensive in some scenarios. However, it is still applicable by collecting a small set of attribute-sensitive training instances and applying data augmentation techniques.
Our method is hard to achieve fine-grained control. We aim to address attribute-based generation that conditions on a given style, sentiment, toxicity, or topic. However, it cannot condition on a piece of content to control the generation. We encourage future works to explore retrieval-augmented generation with fine-grained control signals.
ACL 2023 Responsible NLP Checklist"
288,"We conducted extensive experiments with three datasets from different domains to substantiate the results thoroughly. We observe the best performance when we also leverage the body of the articles. So, we did not evaluate the performance on the datasets that do not have the full text (or equivalently, long text) of the articles.
Ethics Statement
The datasets we used in experiments are publicly available. In our work, we provide a comprehensive analysis and present data augmentation strategies specifically to address keyphrase generation in purely resource-constrained domains. We do not expect any direct ethical concern from our work."
289,"BIGVIDEO is collected from two video platforms Xigua and YouTube. All videos are publicly available. However, some videos may contain user information (e.g., portraits) or other sensitive information. Similar to VATEX and HOW2, we will release our test set annotation and the code to reproduce our dataset. For videos without copyright or sensitive issues, we will make them public but limit for research, and non-commercial use (We will require dataset users to apply for access). For videos with copyright or sensitive risks, we will provide ids, which can be used to download the video. This step will be done under the instruction of professional lawyers.
Though we show that our model with video inputs helps disambiguation, we find that our model could yield incorrect translation due to the lack of world knowledge. For example, model can not distinguish famous table tennis player Fan Zhengdong and give correct translation. We find this is due to video pretrained models are often trained on action dataset (e.g., Kinetics-600 (Long et al., 2020)) and hardly learn such world knowledge. In this work, we do not further study methods that leverage world knowledge."
290,"In this section, we draw conclusions for the limitations of our proposed model in this paper. Our proposed model mainly focuses on the sentencelevel procedural graph construction. The scenario that two actions in the same sentence cannot be considered in our proposed model. It is challenging to handle multi-grained (i.e., entity-level and sentence-level) dependencies between actions. We will consider this limitation as our future work."
291,"The way the method applies to larger datasets needs further exploration. As the number of training examples increases, the accuracy gain over vanilla finetuning reduces, indicating that our method best works in low-resource scenarios. Another limitation is that we performed experiments only in one language. It will be interesting to apply our method to tasks in other languages and understand the impact of task-dependent similarity structure on the model’s performance in those scenarios. BFTSS Top-K and BFTSS U-V methods perform similarly. Scenarios where BFTSS Top-K and BFTSS U-V differ in performance, should be further explored. We plan to address them in our future works."
292,Left blank.
293,"While EVALM demonstrates that vocabulary augmentation with LRL task performance as objective requires different priorities from vocabulary augmentation for improving representation for its
own sake, our work opens up several avenues for exploration. Our understanding of the potential conflict between fidelity of LRL word representation from wordpieces and LRL task class discrimination requirements remains far from complete, particularly when we extend from sequence-tosingle-label applications to sequence labeling (as in POS and NER tagging) and further to sequenceto-sequence applications (such as translation). Perhaps, further experiments with mBERT and other MLLMs will further our understanding of these trade-offs. While initializing an LRL word embedding using InitHRL or InitMix, we depend on automatic machine translation, which can be errorprone. Ranking by ∆H and picking a prefix fails to discount informative but correlated features. A more sophisticated formulation of loss of information owing to fragmentation, taking multiple LRL words into account simultaneously, may alleviate this problem. In the short term, these two limitations may deserve closer scrutiny."
294,"The proposed CAST framework carries the same limitation of self-training-based methods, which is the requirement for multiple rounds and multiple splits of training. As a result, the GPU computing hours of CAST are longer than those of vanilla baselines and NS."
295,"We proposed a solution to the cosine similarity underestimation problem associated with contextualised word embeddings of highly frequent words. Our evaluations used only a single contextualised embedding model (i.e. BERT) with a single dimensionality (i.e. 768). Therefore, we believe that our proposed method must be evaluated with other (more recent) MLMs to test for its generalisability. Moreover, our evaluations were conducted only on the English language, which is known to be morphologically limited. Although in our preliminary experiments we considered discounting schemes based on the part-of-speech of words (instead of considering stop words vs. non-stop words), we did not find any significant improvements despite the extra complexity. However, these outcomes might be different for more morphologically richer languages. In order to evaluate similarity predictions in other languages, we must also have datasets similar to WiC annotated in those languages, which are difficult to construct. Although having stated that using a single MLM and single language as limitations of this work, we would like to point out that these are the same conditions under which Zhou et al. (2022) studied the cosine similarity underestimation problem.
We used only a single dataset (i.e. WiC) in our experiments in this short paper due to space constraints. Other contextual similarity datasets (e.g. Stanford Contextualised Word Similarity (SCWS) (Huang et al., 2012)) could be easily used to further validate the proposed discounting method in an extended version."
296,"It’s worth noting that this study has certain limitations. One of the limitations is the limited scope of the training data employed. The AltCLIP model is trained on open-source parallel corpora and publicly available unfiltered text-image pairs. A more careful study of the training data, i.e. filtering textimage pairs by relevance and text/image quality may help to further improve the overall performance of the model. Another limitation is the challenge of evaluating the model in a multilingual setting. Despite our best efforts to include as many benchmarks as possible and to translate from English datasets, the evaluation of the model’s performance in other languages is not as comprehensive as it is in English. For example, there may be fewer tasks available such as OCR or action recognition in videos in other languages. In addition, the use of machine translation may introduce biases that could affect performance. Future research should focus on creating a more robust and scientifically rigorous multilingual evaluation framework."
297,"Although we have demonstrated the superiority of our RHGH model compared to previous work on four real-world datasets, there are still two limitations that should be addressed in the future:
(1) As our RGC layer employs the whole graph to learn the embedding of entities and relations, like most GCN’s frameworks, the computational resources and time required by our framework increase linearly with the size of KG. To make our RHGH model effective on the KG with millions of entities, it is desirable to apply some graph chunking techniques, such as Cluster-GCN (Chiang et al., 2019), to reduce the size of the KG for our RHGH model to improve computational efficiency.
(2) Currently, our RHGH model treats each relation individually. However, relation paths consisting of multiple relations will contain more complex semantic information in KGs. Relation paths enable entities to obtain higher-order neighbor information, but it is also more difficult to align relational paths in different knowledge graphs. In future work, we will explore more efficient ways
to utilize the relation path in entity alignment, such as the relation path matching in different KGs."
298,"Section 5.4, Section 6 and Section 7
7 A2. Did you discuss any potential risks of your work? We do not use huge models and our experiments are fair."
299,"Our work has only considered pairwise interactions, but linguistic structure can also manifest through higher-order interactions. We show that our results on small-scale, formal languages, are different from our results on a natural language task.
It would be premature to conclude that small-scale, synthetic tasks can not be predictive of behaviour on more complex tasks, and a more detailed investigation into the properties of the task that play a role is a viable next step. Some of the FIDAMs we considered, most notably SII and STII, are intractable for larger inputs (scaling O(2n)), and a necessary step in employing these methods to larger models is to construct better approximation procedures, e.g. by adapting SHAP to SII as has been done before for tabular data by Lundberg et al. (2018). More generally, although we believe our probabilistic formal language setup provides a important step forward, solving the Attribution Generalization problem – i.e., showing that results for small setups generalize to very large model – remains a key open problem."
300,"Section 9
7 A2. Did you discuss any potential risks of your work? Our work is of a more theoretical nature, providing a new way of measuring the faithfulness of feature interaction methods."
301,"Despite our efforts to collect as many generation tasks and datasets as possible, we only evaluate the generation quality and generality of our models on a small number of tasks and datasets. The interpretability and robustness of our models require further analysis. Besides, there exists subjectivity when collecting downstream tasks and intratask datasets, albeit our attempts to employ widelyrecognized categorizations from the literature. Due to the limitation of computing power, we do not study the performance of our method at different model scales. The effectiveness of multi-task pretraining from scratch, similar to ExT5 (Aribandi et al., 2022), also merits an in-depth study.
Broader Impacts
In this paper, we pre-trained a language model MVP using labeled NLG datasets. According to the research (Bender et al., 2021; Bommasani et al., 2021), PLMs tend to “remember” what they have “seen” in the pre-training corpus. This could result in the reproduction of undesirable biases from pretraining data on downstream tasks. Training data intervention could be a solution to alleviate this issue (Lu et al., 2020). It is also interesting to investigate whether supervised pre-training produces fewer biases than unsupervised pre-training.
Environmental impact is another factor we should consider. We attempt a more efficient pretraining strategy and released our PLM for future work. In contrast to large PLMs with tens of billions of parameters, such as T5 (Raffel et al., 2020) and GPT-3 (Brown et al., 2020), we pre-train only a small model with hundreds of millions of parameters. In addition, we utilize supervised pretraining data and initialize our model with pretrained BART, both of which improve the convergence of our model. Ultimately, our model is pretrained for about 20, 000 steps, whereas the BART of the same size is pre-trained for 500, 000 steps."
302,Section Limitations
303,"We note a few limitations of our work: a) while we systematically investigate the choice of in-context examples for both in- and out-of-domain settings for higher-resource language pairs (EnglishGerman, English-Russian), it is unclear how this in-context ability of the PLM varies for the lowerresourced language pairs; b) We only experimented with one pre-trained language model, XGLM. Our preliminary experiments suggested XGLM-7.5B to result in better translation quality than Bloom7B (Scao et al., 2022) under the same settings. However, further investigation is required to understand how these results vary across different model scales; c) We analyze different orderings for the few-shot task-level prompts but only examine limited sets of ordering (most similar to the left or right) for the example-specific prompts. As the PLM is shown to be sensitive to the ordering of these in-context examples, it remains an open question to study how to best combine the information from multiple example-specific prompts, with prompt ensembling being a viable option, which we leave to future work."
304,Section 9
305,"In the process of conducting experiments, we find our method has some limitations. First, CIF-PT needs to be performed on the dataset with speechtext pair. For some small-scale dataset that only contains speech and SLU labels, our method needs to use external ASR dataset to conduct the pretraining, leading to the increase of complexity of model building. In addition, in CIF-PT, we need to ensure that the tokenizer of the pre-trained language model is consistent with the tokenizer in the ASR task. However, there is usually a gap between the two in terms of vocabulary size. In consideration of performance, it is necessary to modify the tokenzier of one or both sides."
306,"In section 7
7 A2. Did you discuss any potential risks of your work? We believe there is no risk in our work. We only use the open-resource codes and publicly release data from the community, and no misuse of any resource and no other stateholders involved in our work."
307,
308,"One of the limitations of our framework is we need to design the rough range of hyperparameters to search the best setting. In our future work, we will explore the strategy to avoid hyperparameter tuning."
309,"Although our approach exhibits great speedups in encoder-only settings, it doesn’t yield as impressive speedups in encoder-decoder setting. This is due to the autoregresive decoding steps in the decoder, that has to be conducted sequentially. Accelerating that with DCT requires to incrementally update DCT outputs step by step based on outputs of pre-
vious timesteps, which is theoretically possible but not easy to optimize its efficiency. We plan to further accelerate it in this direction in future work."
310,"Language Our experiments are conducted on English, as all Code-LLMs we know are pre-trained on English programming languages. Fundamentally, most popular programming languages are English-based, but international programming languages (which work in multiple languages) like Scratch, or non-English-based programming languages like Qalb also emerge. We look forward to the appearance of Code-LLMs on these programming languages.
Prompt Engineering We manually design the prompts without prompt engineering techniques such as prompt search. The searched prompts may outperform the ones we used, but our experiments on interventions show that CODEX is fairly robust towards format perturbations.
Model LLMs update quickly. From the time we submitted the paper until now, several new LLMs have been released. We try to compare their performance with ours. We select three new LLMs: CHATGPT, GPT-4 (OpenAI, 2023), and BARD4, and feed the text prompts to them. Because we do not have access to some of their APIs, we only experiment on a subset of 100 instances and report
4Experiments are done with models updated to May 10, 2023.
the results in Table 5. CODEX outperforms all these models in the automatic evaluation, but part of the reason is that these models provide more detailed outputs than the reference. We provide a case study in Appendix A.5.
Since CODEX is no longer available to the public, we provide CODEX generation results in our GitHub repository. We also looked for alternatives and tried two open source Code-LLMs CODEGEN (Nijkamp et al., 2022) (version CodeGen-16BMono) and STARCODER (Li et al., 2023) with our code prompts. However, as shown in the case study, their performance is not comparable to CODEX, probably because they are more than ten times smaller in size."
311,"Our approach is based on the assumption of a limited data budget, and the observation that general multi-task training may not be the most efficient method when one cares about single target tasks. As such, DEFT is not applicable to “true” zero-shot settings where one has no information about the target task, since it relies on the existence of at least some unlabelled examples. Furthermore, for some tasks it may be possible to cheaply gather many examples for finetuning beyond the point where DEFT is useful. In some cases, gathering unlabelled examples may not be so much cheaper than gathering labelled examples that it is worth considering whether to gather unlabelled or labelled examples. Additionally, the recent rise of sparse
dataset. Questions were written after reading paper abstracts, and evidence selection required reading entire papers.
mixture-of-expert models (Shazeer et al., 2017; Fedus et al., 2022) may reduce the negative interference effect observed throughout our work, where DEFT models often outperform models trained on all multitask data and random subsets of the multitask data. Finally, we note that in pilot experiments we found that task diversity was a key element of strong held-out task performance. However, DEFT does not explicitly correct for task diversity, and we leave further exploration for extending DEFT to account for this to future work."
312,"We discuss the limitations of our method from three perspectives.
First, our method is based on pre-trained language models, so compared to rule-based data augmentation methods (synonym replacement, shuffle within segments, etc.), our method requires higher time complexity.
Second, the entity matching process (Section 4.3) will discard sentences which cannot match entities in the entity list, which will affect the utilization of data.
Third, our data augmentation method based on the pre-trained language models, whose generalization ability is limited since the augmented knowledge comes from the pre-trained language models. However, the knowledge in pre-trained language models is limited and not domain-specific. How to improve the generalization ability of the data augmentation methods is a future research work."
313,Section 7
