,Text
723,"limitations of image generation but also provides the data necessary to improve visual metaphor generation in the future. we plan to further examine the effect of prompt phrasing on the quality of the generated visual metaphors,and how that effect differs across different models. limitations while the results of human-ai collaboration for visual metaphor generation are very promising, such a procedure might be time-consuming but at the same time necessary for maintaining quality. we want to acknowledge that both our llm and bestforming diffusion models are released through a paid api and are not open-sourced. while our best-performing system uses chain of thought prompting, there are several other prompting or task decomposition techniques that we did not perform an extensive comparison with.last but not least, there is still enough room for potential improvement in generating visual metaphors which can be achieved by designing better prompts or by improving the compositional generalization of diffusion models. we also recognize the inherent limitation of an english-only basis for our visual metaphors and hope in the future to expand to other languages for source material."
724,"limitations to address the low-resource data in the training of tau-dr, we apply two heuristics, dataset enrichment and generation from different checkpoints. despite being effective, they require additional computational time that might be challenging in applications with low-computational resources. a possible approach to reduce the computational time might be to average the checkpoints. we believe that this might lead to competitive results, with a significant reduction in computational time, since checkpoint averaging proved to be an effective approach in low-resource settings. another limitation is when the original dataset is in a highlyspecialized domain that might contain domainspecific phrases that were most likely not included in the pre-training data of the language model. the results obtained by existing data augmentation approaches will most likely exhibit only marginal improvement."
725,"limitations we showed that our proposed method can greatly improve the performance of parameter efficient tuning on diverse nlu tasks and three different pre- trained models (i.e., roberta-large, debertalarge and gpt2-large). however, we acknowledge the following limitations: (a) the more super-sized pretrained models with tens of billions of or more parameters were not studied due to limited computation resources. (b) other tasks in natural language processing, like the text generation tasks, were also not considered. but our framework can be easily transferred to other backbone architectures and different types of tasks. it would be of interest to investigate if the superiority of our method holds for other backbone models and types of tasks. and we will explore it in future work."
726,"limitations apart from the issues mentioned in § 5.4, another limitation of trenc is that it does not integrate any pre-training process such as bert, which is effective in increasing the language understanding ability and adopted by previous works focusing on token-level classification tasks (wang et al., 2022; deng et al., 2022). two factors lead to this decision. first, we use dom nodes instead of tokens as the classification object and focus on relations between nodes rather than tokens. as the node text sequence is a composition of an arbitrary number of tokens, adopting the conventional masked language modeling (mlm) training objective (devlin et al., 2019) seems impractical since there is no direct mapping from an embedding vector, one-hot encoded or not, to a sentence. the second reason is simply that we do not possess the corpus or computation resources for model pre-training. in fact, we expect a properly designed pre-training scheme to bring better node semantics representation and si-pt relation modeling. it is an interesting topic and deserves further study."
727,"limitations we see two main limitations of this work. the first one concerns the diversity of the language models and datasets used. bert, distilbert and roberta have similar architecture, and sst2, imdb and rotten tomatoes are datasets designed to evaluate the sentiment of english text. it would therefore be interesting to validate the robustness of our results on more diverse languages, tasks and language models. in this short paper, we decided for brevity to follow the experiment design of sanyal and ren (2021), while being aware of its inherent limitations. the second limitation of this work concerns the time complexity of sig. as it needs to compute explanations for each word individually, this method can become very computationally expensive when applied on large text data. to alleviate this issue, we first made it possible to compute gradients in parallel, using an internal batch size similar to how captum (kokhlikyan et al., 2020) implemented the integrated gradients method. secondly, as discussed in 3.2, it is possible to reduce the number of interpolated points, which makes the computation faster while retaining better performance than the original ig. in this work, we ran our experiments on a machine with 16 cpus, and one nvidia tesla t4 gpu. with this setting, computing sig on sst2 and rotten tomatoes takes around one hour for each model. on the larger imdb, computing sig, on 2000 randomly sampled inputs, takes around 5 days for bert and roberta, and 2 days for distilbert."
728,"limitations and future work one limitation of our method is that sampling requires sampling both a conditional and a unconditional model, which results in slower inference times. on the other hand, progressive distillation (meng et al., 2022) provides an attractive solution to this problem. another limitation is that ho and salimans (2021) show that the diversity of generative models is degraded as w increases. ideally we would be able to have a model that improves upon the fluency as well as the model diversity. as for future work, we will leverage advanced large language models as the base architecture for training diffusion models to compete with high performance auto-regressive models. additionally, we will investigate modifications to diffusion models that are inherent to discrete data."
729,"limitations as mentioned in sec. 2, the current selection of fundamental reasoning skills for language models is limited by the availability of well-defined tasks and clear definitions of those tasks, as well as the availability of sufficient training data. as a result, some skills may overlap or may not be fundamental enough. for example, simple qa skill may overlap with ner skill to some extent. in the future, it would be worthwhile to explore self-supervised training tasks that can inject more fundamental abilities into language models. additionally, the selection and combination of fundamental reasoning skills can be further explored. for example, the inclusion of numerical reasoning ability to solve mathematical problems. additionally, methods for skill-centric pre-training corpus construction can also be explored to improve the effectiveness of these skills."
730,"limitations the primary constraints encountered in our research result from our dependence on a single dataset for experimentation and computing resource limitations. despite these, we postulate that our ranking-based methodology can be utilized for any summarization task that necessitates robust correspondence with a specific structure within the input. to validate this hypothesis, further experimentation is required to assess the generalizability of our technique to alternative datasets and domains. in addition, our limited computational resources prevented us from experimenting with other long document encoder-decoder models such as bigbird and longt5 (michalopoulos et al., 2022; guo et al., 2022) as well as using higher beam widths during decoding. furthermore, the cost and complexity of procuring expert evaluators within the legal domain resulted in using automatic metrics alone. ethical considerations the usage of the generated summary results from legal opinions remains important. abstractive summarization models have been found to contain hallucinated artifacts that do not come from the source texts (kryscinski et al., 2019; zhao et al., 2020; kryscinski et al., 2020). while our model incorporated the argument structure of the source article, the generation results may still carry certain levels of non-factual information and need to be utilized with extra care. similarly, as mentioned in the prior line of works using canlii (elaraby and litman, 2022; zhong and litman, 2022), canlii has taken measures to limit the disclosure of defendants’ identities (such as blocking search indexing). abstractive approaches may cause user information leakage. thus using the dataset needs to be cautious to avoid impacting those efforts."
731,"limitations we would like to acknowledge the following limitations of this work. our study setup only takes advantage of supervised data in the form of triples of <speech, transcriptions, translations>. this is because we first and foremost want to investigate the effectiveness of pseudo-labeling in the most extreme case. however, the setup can be extended to be able to also rely on asr-only (<speech, transcription>) and st-only (<speech, translation>) pairs. we leave incorporating asr and st data as a future work as well as incorporating external language and machine translation models. we identified two sources of domain mismatch: input length ranges and vocabulary mismatch. however, the solutions that we investigate directly target the length mismatch, without explicitly addressing the vocabulary mismatch. the latter is indeed more challenging to address, especially without incurring additional supervision. in fact, circling back to the previous item as a future direction, incorporating supervision in the form of asr or st can expand the vocabulary set, also addressing vocabulary mismatch."
732,"limitations the limiation of this work is that we only consider one type of prefixes/suffixes, i.e., negative prefixes/suffixes. in our future work, we would like to work on other types of prefix/suffix sense detection tasks, such as prefix/suffix sense detection on occupation. for instance, in english, there are many suffixes such as -or, -er, and -ee, which mean a person with a certain occupation."
733,"limitations in this study, we propose differentiable segmentation to learn how to segment speech from the underlying translation model, and verify its effectiveness on simultaneous speech translation. however, since it can be jointly trained with the underlying task (sequence-to-sequence task), differentiable segmentation is not limited to the simulst task, but can be generalized to more streaming/online tasks, such as streaming automatic speech recognition (streaming asr), simultaneous machine translation (simt), real-time text-to-speech synthesis (real-time tts), online tagging and streaming parsing. given that there may be some task-specific differences between various tasks, this work only focuses on the differentiable segmentation in the simulst task, and we leave the study of how to apply differentiable segmentation to other streaming tasks into our future work."
734,"limitations so far jgr has only been evaluated on the domains of summarization, conversational summarization, question generation, and dialog. it should be evaluated on a wider range of benchmarks, such as machine translation and code generation. and we have not explored jgr’s performance with extralarge language models such as gpt-3. we will evaluate jgr on the above points in the future. because the generator of jgr samples candidates using auto regressive sampling, it may occupy relatively longer computational time and larger memory then the conventional mle training. though the performance of jgr is satisfactory, we still want to improve its computational costs. we will try non-auto regressive sampling and other improvements such as parameter sharing in the future."
735,"limitations in this section, we discuss some limitations of our work. we conduct preliminary experiments to verify the influence of task transfer and vocabulary expansion on language learning in complex forms, and to explore the effectiveness of our proposed architecture, symbolic mapping, and we assume that language was formed through simple interactions in the early stage. therefore, additional experiments involving more complex games or other input forms like real images have not been studied and are left for future work. besides, more advanced language properties and syntax are temporarily not studied in this work. as for task transfer, we verify the effectiveness of a two-stage curriculum starting from referential games, while more advanced curriculum are left for future work, where more cognitive science findings should be involved."
736,"limitations first of all, our study is limited to languages that use the latin script. still, the 4 languages are from different language families and are typologically diverse. secondly, the low-resource scenario is simulated. as mentioned in 3, in order to carry out the experiments the languages involved were required to have enough monolingual data to train lms, as well as available evaluation datasets for nlu tasks. the source of the pre-training corpora for swahili and finnish (cc100) is not completely comparable with the corpora used for basque and spanish (75% news, 25% wikipedia), due to the unavailability of a large curated corpus for swahili, and the lack of big news corpora for finnish with an open license that allowed us to share freely the pre-training data. 16https://github.com/orai-nlp/low-scaling-laws our study is limited to 3 language model sizes and 3 pre-training corpora sizes. including other model sizes like a bert-large or a model between 51m and 16m (where there is a big gap in results), and adding more pre-training corpora sizes (let’s say 625m and 1m words) were out of the scope of this work. in addition, we use the default hyperparameters that are commonly used for bert-base (bert124m ) for the pre-training and fine-tuning of the bert51m and bert16m models without any hyperparameter tuning."
737,"limitations this paper proposes a pre-trained language model with prompts for temporal knowledge graph completion. however, there are some limitations in our method: 1) our prompts in the temporal knowledge graphs, especially the time-prompts, are built manually. it needs to be reconstructed manually for different knowledge graphs. we are exploring a way to build prompts in temporal knowledge graphs automatically. 2) our model uses a random sampling method, which suffers from the problem of few high-quality training samples and high sam- ple noise. for future work, a more effective way to sample is worth exploring."
738,"limitations although the proposed method provides interpretations for continuous prompts with both faithfulness and plausibility, it can still only be used as an approximation to find the most likely combination, since the process of combining discrete prompts to continuous prompts is irreversible. moreover, the output layer of plms tends to degenerate and occupy an anisotropic cone in the vector space (wang et al., 2020; li et al., 2020b), which significantly increases the difficulty of finding the correct interpretations. we encourage future research to take the magnitude of token vectors and the tokens in their neighborhoods into consideration for a more robust interpretation. due to space and time constraints, we only perform detailed experiments on p-tuning and the bidirectional language models like bert and roberta, which ignored numerous sota works such as prefix tuning (li and liang, 2021), prompt tuning (lester et al., 2021) for continuous prompts and gpt (radford et al., 2019), t5 (raffel et al., 2020) for plms. we encourage future research to conduct experiments on more prompt methods and plms to investigate the generalizability of our method. ethical statement we propose a novel view to interpret continuous prompts, which have been considered ""black boxes"", as combinations of human-understandable discrete tokens. since the method itself is unbiased and faithful, and all experiments are conducted on publicly available datasets, we believe that our work does not create any potential ethical risk. further, we discover shortcuts latent in continuous prompts, implying that systematic biases or discrimination may also exist in continuous prompts. these biases may originate from training datasets which are exploited by continuous prompts as a shortcut to the acquisition of true labels, or even originate from artificially implanted backdoors. we hope this work will provide the possibility to detect these potential biases in continuous prompts. our created artifacts are intended to provide researchers or users with a tool for understanding decision-making and detecting possible unexpected shortcuts of continuous prompts, while at the same time offering the feasibility of cross-model transfer without extra training signals on target plms. they are compatible with the original access conditions. all use of existing artifacts is consistent with their intended use in this paper."
739,"limitations all our experiments are performed using the bertsmall language model due to the computational requirements of generating and testing models considering many configurations of adversarial training and attack methods. although using larger language models might have provided different performance measurements, our findings that compare input- and embedding-space adversarial training methods are expected to remain unchanged. another limitation of our work is the semantic gap between attacks in input and embedding space needs further research. specifically, how do perturbations in the embedding space get translated in the input space? finally, other forms of robustness techniques, besides adversarial training, in the context of large language models require examination."
740,"limitations gdmm establishes a compelling starting point for dmel research. in spite of this, the proposed approach has several shortcomings. first, gdmm currently generates entity name within the entity candidate set, however, we saw how retrieval errors limit entity linking performance. thus, how to work collectively with the retrieval system to diminish errors takes appropriate action. second, how to handle large tables still remains under-explored. it is infeasible to represent a huge database with the table flattening technique. in practice, it is possible to filter out less likely candidates to compress the search space, but a more promising approach is to represent the table more efficiently. gdmm also enables studies on more diversemodal tasks. new tasks can be easily framed based on the proposed architecture, such as visual question answering, grounded generation, and diversemodal commonsense reasoning. we believe that with more follow-up work on diverse tasks, this approach will turn out to be a more comprehensive generative diverse-modal framework."
741,"limitations one limitation in this work is the metrics employed in the automatic evaluation. the metrics mainly focus on the quality of generated response and the accuracy of emotion recognition, while automatic evaluation lacks a comprehensive method to evaluate empathy. another limitation comes from the utilization of the dataset designed for open-domain dialogue system, so that the generated response from the proposed framework is not task-oriented. in the future, we will build empathetic dialogue generation datasets with diverse and task-oriented response, and develop metrics to evaluate the understanding of the speaker’s situation."
742,"limitations the loss objective of the proposed siwcon regularization is computed on augmented data, which increases the time required for the model to complete training. we evaluate siwcon on classification tasks, but it may be applied to various other tasks, such as reading comprehension and textual entailment. more evaluations are expected to be done in future works. the proposed siwcon regularization is effective in defending against word-level adversarial attacks, as the basic elements of the augmentation methods are words. however, similar regularization techniques can also be applied to characters and sentences, and we leave evaluating the effectiveness of such variants in future works."
743,"limitations resulting from the use of gpt-3 discussed above, there are more general ethical questions surrounding the use of gpt-3 and similar models, for example the high energy usage and resulting carbon emissions, and societal questions around the oligopoly on state-of-the-art language models that is currently in the hands of a handful of large us-based companies. the second consideration relates to the task that we introduce: while we see perspective transfer models as a valuable tool for studying how language ‘frames’ (social) reality that could also have practical applications, for example in journalism, we strongly believe that any such applications must be approached with extreme care. the models that we introduce are scientific analysis tools that could be used to suggest alternative viewpoints on an event, but we believe that generations should not be seen as necessarily reflecting a ‘true’ or ‘better’ perspective, and should not used in a prescriptive way (i.e. used to tell someone how to write). we believe that the authors (journalists or others) of any text ultimately bear exclusive responsibility for the views, perspectives and (implicit) values expressed in it, and should be careful in making use of texts (re-)written by computers, such as the ones produced by our proposed models. finally, we are aware that our task domain (femicide/gender-based violence) is a societally and emotionally loaded topic, and that the texts contained in our dataset and produced by our models might be disturbing. in particular, in some cases, models may produce graphic descriptions of violence and/or produce questionable moral judgements (e.g., we have occasionally seen statements such as “the perpetrator of this horrible crime does not have the right to live” spontaneously produced by some of the models), and potential users of applications of the model should be aware of this. for the purposes of this paper, the only people external to the research team who have been extensively exposed to model outputs were the annotators in our human evaluation study. in the introduction page of our online questionnaire, annotators were warned about the sensitive nature of the topic and advised that they could stop their participation at any time if they felt uncomfortable and could contact the authors with any questions. prior to running the online questionnaire we have requested and obtained ethical approval by the ethical review committee of our research institution. author contributions authors g.m. and h.l. share first co-authorship (marked with ‘*’). g.m. had primary responsibility for data collection and preparation, setting up the gpt-3 experiments and running the human evaluation survey. h.l. had primary responsibility for the mbart experiments and the automatic evaluation. b.m. annotated data (pair alignment) and contributed to prompt engineering and the design of the evaluation questionnaire. m.n. coordinated and supervised the overall project."
744,"limitations explored above, we identify several potential risks with this paper. some may be offended by the images we include. we tried to mitigate this risk by including a warning in the abstract and not including images featuring genitalia. however we appreciate these images may contribute to the sexualisation and objectification of non-cisgender people, particularly if taken out of context. though we did not set out to generate offensive images (this would be counter to the models’ intended use, for example as specified by dayma et al. (2021)11), images from the full data set could 11https://huggingface.co/dalle-mini/ dalle-mega similarly offend and even be weaponised. they might accompany transphobic messages online. a data set of cisgender and non-cisgender images labeled by photorealism and presence of a clear face could feasibly be used to finetune a model to identify non-cisgender people (a concern raised by the community). as such, we make our image data set available only upon request; it is intended to measure the harm done to non-cisgender people, not contribute to it."
745,"limitations our comix approach assumes availability of parallel bilingual (embedded and matrix language) corpora and mature tools for pos tagging and phonetic transcription for both the embedded and matrix languages which does not hold true for every language. but these assumptions are reasonable for a large number of languages as shown in appendix 7. second, our current choice of guiding function for attention fdkga and mixing probability pmix are based on limited knowledge of the linguistic structure specific to english and indic languages, and might need to be adapted for other language families. additionally, as discussed in section 4, due to multiple variations in code-mixed generation, current automated metrics that compare system generated text with reference text do not provide a true reflection of a system’s ability to generate code-mixed text. lastly, as with large language models, our comix models are also vulnerable to biases inherent in the training corpus."
746,"limitations, future directions and"
