,Text
0,
1,Left blank.
2,"The performances except for the proposed tasks. We presented the result of neologism and the performances on two downstream tasks (i.e., word similarity task and short text classification), which are closely related to the understanding of word semantics. The selected downstream tasks are challenging for the contextualized models; they can use only a few contexts to make a representation.
The performance in general benchmarks (e.g., GLUE) is almost the same as the vanilla BERT because our model suffers catastrophic forgetting while learning definition information. Sophisticated modeling and training processes to overcome the problem could be interesting future work.
The use of other models Other pretrained models like RoBERTa could be a base model of our method (e.g., DefRoBERTa). However, we think that BBPE tokens scarcely have semantic meanings, which makes it hard to find appropriate tokens to inject definition information. Therefore, integrating human-written definitions with other types of tokens (e.g., Byte-Pair Encoding and Byte-level BPE) is also a future direction.
The use of all the loss function& Collect more definition data. Presenting more experiments with other models, other collections of definition data, and other loss functions will further support our idea. Nevertheless, we want to show the performances with the widely-used basic model of pretrained language models (i.e., BERT), using definition data from the previous work, with various loss functions (e.g., W-D, D-E, [+W’], [+E]) as many as possible. A fine-grained combination of all the loss functions could make further improvements."
3,"There are several perspectives from which we need to consider the ethical considerations of this work.
Privacy: Lifelogs are personal data and should only be used and shared given user authorization. The lifelogs presented here are fictitious and do not reveal the personal information of any individual. No personal data is used to create this benchmark. This work is intended to unlock development in the creation, maintenance, querying and usage of lifelogs, and additional work will certainly be needed to ensure that they are secure and being meaningfully and responsibly used.
Comprehensiveness and diversity: We recognize that the lifelogs generated in this work are far from representing the full range of human experiences. While we strived to make the lifelogs complex enough to benchmark and compare current stateof-the-art, these lifelogs would not be considered diverse in the sense that a social scientist would note, and are likely biased by the life experiences of its creators. We encourage future work in creating lifelogs that are more inclusive and faithful to all walks of life. This includes further work in making lifelogs that are more diverse in terms of life experiences, personas, time scales, and queries as well as more granular and complex in detail. The strength of the benchmark is in identifying patterns of questions on lifelogs rather than the specific events described in them.
Inferring episodes: TimelineQA is a collection of time-and-space boxed episodes, and not the raw data itself from which the episodes are inferred (e.g., a wedding photo, or video snippet from smart glasses). Naturally, more research would need to be devoted to understanding how to extract important information in natural language and infer episodic events from this raw data before performing question answering. As mentioned previously, this also involves sometimes grappling with the linguistic variation amongst the language used in the episode description and the query itself.
Intended use: We clarify that the benchmark should not be used to train models for making key decisions that will impact people’s lives (e.g., job matching, insurance approvals or building personal assistants). The intended use of TimelineQA is as a benchmark to reveal potential limitations of QA systems over lifelog data. Even if the benchmark is determined to be sufficiently comprehen-
sive, a detailed study should be conducted to understand the potential representational harms of using TimelineQA before using it for training models. Conceivably, TimelineQA can also facilitate research in evaluating the biases of QA systems by creating counterfactual pairs in the dataset: two timelines which are exactly the same, but differ by the demographic group or a specific life event (e.g., having dropped out of college or committed a crime). The QA system can then be systematically probed for differences in performance between the two timelines."
4,"Our approach to universal text perturbations suffers from linguistic inconsistency, which makes them easier to detect. Therefore, as the next step of our research, it would be interesting to investigate
the possibility of improving the naturalness of adversarial triggers without degradation of the attack performance in terms of the fooling rate.
While the proposed approach outperforms the UATs of Wallace et al. (2019) in the transferability task, we should highlight that the additional hyperparameters adjustment plays a crucial role, and one could suggest validation procedure refinement for a more fair comparison. Also, for both direct and transferability settings, a more comprehensive range of models should be examined, including recurrent (Yuan et al., 2021) and transformer architectures, e.g., T5 (Raffel et al., 2020), XLNet (Yang et al., 2019), GPT family models (Radford et al., 2019; Brown et al., 2020).
Another direction of improvement is related to the fact that sometimes the found triggers can change the ground truth label of samples they are concatenated to if, e.g., they contain words contradicting the true sense of a sentence. It would be interesting to analyze how often this happens and develop an approach to tackle this issue.
Finally, it would be interesting to investigate the dependence of attack efficiency on the size of a training set and compare it with the so-called data-free approaches, such as the one proposed by Singla et al. (2022)."
5,"In this work, we first formulate the scene-robust NLVL problem and propose our solution. However, our generalizable NLVL model is still tested on existing close-world datasets, and the actual performance in real-world scenarios needs to be further explored. A real-world, large-scale dataset is required to develop a practical, generalized, openworld query-based video retrieval model."
6,In the Sec 6 and Appendix.A
7,"Time Granularity: The granularity of time we test DynaMiTE on ranges from spans of four years to months. After testing multiple ways to bucket our temporal corpora, we observed that the granularity of time only affected DynaMiTE when there were insufficient documents in each time step. Specifically, we found that there must be at least 100 documents per time step to expect reasonably good results. Runtime: One drawback of DynaMiTE is that its runtime depends on the number of terms required at each time step. However, this can be avoided by mining more than one term during each iteration of the framework. We also observed that DynaMiTE, along with all other dynamic topic mining baselines, had a slower performance on datasets with longer text documents. Risks: DynaMiTE is intended to be used as a tool to discover topic evolutions in temporal corpora suited to a user’s interests, represented as category seeds. We only experimented with DynaMiTE in domains with trustworthy information. If DynaMiTE was used in document collections that contain misinformation, it could have the potential to mine inaccurate terms."
8,Section 8
9,"There are majorly two limitations: Firstly, we collect a Chinese singing voice dataset and test our method only on this Chinese dataset due to the difficulty of recruiting professional singers in different languages. In the future, we will attempt to collect the singing voices dataset including more languages and test our method in multilingual settings. Secondly, our method adopts the diffusion model in pitch modeling and the postnet, which require multiple inference steps. We will try advanced acceleration methods for diffusion models in the future."
10,"The present study is limited to exploring biases in MLMs for the gender dimension only. For future work, important dimensionalities can be explored, especially for non-western contexts like Caste, Ethnicity, etc (Ahn and Oh, 2021; Bhatt et al., 2022). We also used Machine Translation on English counterfactuals to obtain CDA data in each language in our dataset. Translations are prone to errors and issues like Translaionese (Gellerstam, 1986), especially for the lower resource languages, and therefore can lead to the unreliability of the quality of generated counterfactuals were generated. In the future, we would like to explore learning generative (Wu et al., 2021) or editing models (Malmi et al., 2022) for automatically generating gender counterfactuals given text data in different languages. This can help us scale our counterfactual generation process to a much higher number of samples while also avoiding any losses in quality that may arise due to machine translation. Our multilingual DisCo metric is currently limited to 6 Indian languages and we hope our work will inspire further extension to cover different language families for improving the focus on multilingual biases evaluation."
11,"Section 6
A2. Did you discuss any potential risks of your work? Not applicable. Left blank."
12,"Our proposed graph-guided SQL generators are superior in generating complex SQL queries. How-
ever, the model has a large number of parameters and requires more computational resources, which is a common problem with current methods of generating complex SQL queries.
In addition, the proposed knowledge-enhanced re-ranking mechanism is proposed to leverage the knowledge in PLM to choose the best SQL query from the beam output. However, it does not take into account the database schema which can be the source of domain knowledge.
In the future, we will design lighter models for complex and cross-domain text-to-SQL generation and explore some other re-ranking mechanisms to incorporate the prior knowledge of database schema."
13,Section 7
14,"Domain KGs are the premise of KnowledgeDA, while open and high-quality domain KGs may be rare in some domains. Therefore, the method will be limited in the domains without suitable KGs. Besides, we use a similarity-based method to map entity mentions in the text to the corresponding entities in the KG. Although this method performs efficiently, it ignores the problem of entity ambigu-
ity (Vretinaris et al., 2021). For instance, the abbreviation, CAT, can stand for ‘catalase’ or ‘COPD Assessment Test’ in healthcare. To address this problem, it is necessary to use contextual information to clarify the specific meaning of the mention (Phan et al., 2017; Orr et al., 2021; Vretinaris et al., 2021). Last but not least, KnowledgeDA may be not good at tasks of paragraph-level texts and the efficiency will reduce. Because long texts probably contain more entity mentions and have more complex syntax, it is more difficult to retrieve the entities and acquire their relations from the KG."
15,Limitations
16,"The scope of this work is limited to sentence-level detection due to the absence of any span-level annotated datasets for hyperbole detection. Also, we could only partially annotate the metaphor datasets due to resource constraints. Finally, we did not try sophisticated large language models in our work as our goal was to demonstrate the effectiveness of multitasking using a simple model, rather than to test the performance of more sophisticated models."
17,Limitations
18,Limitation section at the end.
19,"Our work has focused strongly on the formal aspects of BPE. NLP practictioners should not be dissuaded from using BPE for subword tokenization, despite our presentation of examples where greedy BPE fails. Indeed, in contrast to synthetic examples on toy alphabet, on real data we made an observation that greedy BPE may be close to optimal."
20,"For web-augmented models including our work, the deterioration of search results from search engine highlights the importance of deriving an effective method to interact with the huge web. Search engines are often perceived as black-box and non-transparent for end users. Therefore, many works proposed “leaning to search” to decompose complex questions into simpler queries, which may improve the performance of web-based models (Nakano et al., 2021; Komeili et al., 2021).
In our model, we used a commercial search engine as the retriever to work with the whole web as a knowledge source. Since the web is not curated and well-structured like Wikipedia, we may encounter unexpected safety issues, including misinformation and harmful contents. While we have relied on the security control of the search engine, more attention should be paid to better understand the risks and provide effective ways to mitigate them. We hope our simple approach and strong results could encourage more future work by the community to tackle these questions. To encourage the community to investigate the question and ensure reproducibility, after the reviewing process, we will release the search URLs used in our experiments.
As for the potential concern, since we use the search engine to access real-time information, we do not have a tight control over retrieved results as traditional end-to-end retrieval (Guu et al., 2020; Lewis et al., 2020b). Not only the changes of search engine logic, but also the newly published information, might create discrepancies over the course of time. This is also an issue we have to tackle to build a stable web-based solution for PLMs."
21,"Although our proposed method is effective in three vision-language tasks, we still have some limitations. Firstly, we utilize T5 to convert the questionanswering format into the declarative sentence in VQA and it works well in most cases, but it still faces out-of-coverage problems, which will affect the following zero-shot prediction of CLIP. We need to design more rules for these special cases for better conversion. Secondly, our clustering algorithm for SNLI-VE can achieve strong zero-shot performance, but the clustering centroids are close to each other and the algorithm is sensitive to these centroids. The robustness of this algorithm should be improved. What’s more, we leverage FasterRCNN in visual fine-grained information extraction, so the detectable object attributes and classes are constrained in a relatively limited object set of Faster-RCNN, which may hinder further improvement from visual fine-grained information. The Faster-RCNN can be replaced with a better vision module. Besides, since we only utilize CLIP in our paper, we can explore the zero-shot ability of other
contrastive pre-training models in future work."
22,"The current work does achieve better performance than previous methods, but processing only one slot type at a time also reduces the efficiency of the model. In the future, we will explore how to maximize model efficiency. It would be an interesting challenge to generate answers for all the slots at once without degrading the effect of the model. Also, we will also try to apply our framework to more scenarios, such as NER and other tasks to explore the adaptability of the proposed method.
ACL 2023 Responsible NLP Checklist"
23,Section 4(line 288 293) and Appendix E.
24,"Compared to vanilla prototypes, the advantage of HyperProto would also rely on the additional radius parameter. Under the 1-shot setting, however, hypersphere prototypes will face challenges in estimating the radius in support sets, this is because the initial radius may be biased by the randomness of sampling. When the radius is set to exactly 0, the model will resemble a traditional prototypical network. Nevertheless, although not as large as the boost in the multi-shot setting, we find that having a consistently optimizable radius parameter at the training stage in the 1-shot scenario still delivers non-trivial results and exceeds most baselines (Table 1, Table 2, Table 3). This further points to the positive influence of the added radius parameter to learning prototype representation and hints on the possible research direction in learning a transferable radius in 1-shot scenario."
25,"As shown in Table 1, our method is experimentally demonstrated to be effective for two LLMs. However, OPT, a decoder-only model, is more suitable for the prompts generated by Co-Prompt. This seems to be because T0, the encoder-decoder model, requires a separate generator such as GPT2. The performance of prompts may vary to the generator involved in the vocabulary and training process. Also, there is a trade-off between search time and performance. While increasing the beam size and the number of document-query pairs enhances the probability of finding a more optimal
prompt, it makes the search time proportionally longer."
26,"I discuss the limtations at section ""Limitation""."
27,"Despite showing non-trivial improvements in the multi-hop capabilities of T5 models, our work has multiple limitations.
Restricted to 2-hops First, we chose 2WikiHopMultiQA (Ho et al., 2020) as our primary dataset since it uniquely maps each question to a chain of triples that contain the precise, noiseless single-hop knowledge required to answer the question. However, this comes at the cost of our analyses only being restricted to 2-hops (though see arguments by Press et al. (2023, sec 3.5) who suggest 3-and4-hop questions to be too convoluted to understand even by native-speakers). Nonetheless, our random walk training method is general by definition, and can be extended to multiple hops, though its effectiveness on QA tasks requiring more than 2-hops of reasoning remains to be measured.
Knowledge Graph size Our focus in this paper was to allow models to chain together their internalized knowledge in order to answer complex 2- hop questions. However, this critically requires them to possess the world knowledge required to answer the questions, for which we had to memorize the KG constructed using the structured triples provided in the dataset. This trade-off between focusing on knowledge composition vs. fully encoding world knowledge restricted our KG to be small in size (only 98,284 entities and 29 relations), which could be impractical in most real-world applications. In future work, we will experiment with larger sized KGs (Vrandečić and Krötzsch, 2014), by adding a substantially larger amount of additional triples to the existing KG, and measure their impact on multi-hop reasoning.
Lack of diverse QA tasks Finally, we were unable to consider popular datasets with CBQA versions such as TriviaQA (Roberts et al., 2020), NaturalQuestions (Kwiatkowski et al., 2019), etc., due to their lack of links from questions to structured knowledge. Future work can apply entity and relational linking techniques (Balachandran et al., 2021; Agarwal et al., 2021) in order to augment such QA datasets with (possibly) noisy links to structured knowledge, which will allow us to paint a more holistic picture of our methods. Additionally, this would also overcome the above limitation (of KG size), as it would substantially increase the amounts of entities and relations to be encoded
within models.
Implications for Larger Models Although we show clear improvements in triggering 2-hop reasoning in the largest T5 LM (T5-XXL), with 11B parameters, contemporary work has shown that multi-step reasoning capacities naturally emerge in LMs that are two or three orders of magnitude larger (Brown et al., 2020; Chowdhery et al., 2022; Wei et al., 2022b,a). However, these LMs benefit from examples in-context (especially since tuning them is non-trivial and expensive), and therefore it is unclear whether our methods can improve such models’ capacities even further. We have not tested such LMs in our work, due to resource limitations."
28,
29,"Regarding data collection, we crawled the English WikiHow website from Jan 2021 to May 2021. The number of available activities is limited by the data we crawled from WikiHow. We currently only
choose Gardening and Crafts categories as case studies. Because we focus on multimedia imagestep pairs, we remove steps that are not attached to any illustrative images. We also observe that a small portion of activities in the dataset do not follow chronological order.
Since our task focuses on the daily stereotypical tasks which usually require the model to understand the visual environment, the model design can be directly applied to support other domains, such as steps in the cooking videos. In addition, our model can also adapt to scenarios without visual images because the performance of our model only decreases slightly if no caption is provided. We plan to expand our model to other categories written in other languages."
30,"The model might generate incorrect nouns because of the occurrence of patterns (e.g., “refrigerate the slane for up to 1 year” instead of “refrigerate the purslane for up to 1 year”). In addition, our model sometimes tends to generate generic step descriptions because of insufficient input information, e.g., given the last step “lay the t-shirt out on a clean, flat surface.”, the model generates “cut the shirt out” which is vague compared to ground truth “carefully cut around the sleeve”. Moreover, the pretrained model might focus more on language modeling instead of inherent logic: for the activity of “make paint can planters”, after “removing the label” from the paint can, the BART+CAP generates “read the label”. In addition, there is still a small chance that the model generates the same output for various similar inputs.
Because we rely on image captions and retrieval results for step prediction, the upper bound of our generation quality is limited by the performance of the image caption and sentence retrieval modules. Our framework also needs to improve on imbalanced topics in the dataset. For example, the dataset contains more activities about tree for the gardening domain than other gardening-related plants. Because our multimedia generative script learning is a new task, we cannot compare our model with other established state-of-the-art models. Moreover, because WikiHow is a crowd-sourcing website, some everyday activities might have better human annotations than the remaining activities. We plan to include a fine-grained human written step prediction as an upper bound to address this issue."
31,"The automatic metrics we chose, including BLEU (Papineni et al., 2002), ROUGE (Lin, 2004), METEOR (Denkowski and Lavie, 2014), BARTScore (Yuan et al., 2021), self-BLEU (Zhu et al., 2018), and unique n-grams (Fedus et al., 2018), might not be the best metrics to evaluate our results. Some other metrics, such as semantic similarity and multimodal-retrieval based metrics, are based on pretrained models, including Augmented SBERT (Thakur et al., 2021), SentenceBert (Reimers and Gurevych, 2019), and CLIP (Radford et al., 2021). Those metrics might not align with human judgment and might be biased toward pretrained datasets. While we complement it with human evaluation, we only focus on relevance to ground truth and diversity. Although we found fluency is not an issue, it is likely we still need to cover all aspects of generation results."
32,"While our approach is shown to be effective in improving the zero-shot adaption ability of these PLMs, the scope of this work has only been extended to English languages and has not been tested on other languages. In addition, another limitation of this work is the scope of the aspect. Aspect is defined across 3 main categories of intent, sentiment, and topic in the work. However, given the massive space of text label interpretations, our aspect range can be refined and expanded even further, lending to more analysis of the stability of implicit & explicit training as the number of aspects grows. We do not investigate this scenario in this work."
33,"Like other controllable text generation methods (Dathathri et al., 2019; Krause et al., 2021; Liu et al., 2021; Lu et al., 2022; Arora et al., 2022; Adolphs et al., 2022), CLICK also relies on automatic neural classifiers when constructing DCL in some tasks (language detoxification in § 3.1 and sentiment steering in § 3.2 in our work). It may unavoidably inherit the biases and limitations of these classifiers. For instance, for the task of language detoxification, the toxicity may be overestimated when the input prompt or the continuation contains minority identity mentions. To address this limitation, we conducted human evaluation for all the tasks, which further confirms the effectiveness of CLICK. As more accurate, inclusive, and reliable classifiers are built (e.g., for toxicity detection), we expect that CLICK would inherit those improvements as well."
34,"There are still some limitations of our work. In the future, we plan to enhance the procedure of extracting candidate keyphrase, to improve the upper bound of the performance of keyphrase extraction. One possible way is to generate candidate phrases of the document by utilizing the high-level semantic relatedness (e.g., attention weights) instead of using the surface-or syntactic-level information."
