,Text
529,"limitations firstly, from the technical perspective, we have advocated the advantages of our proposed listwise loss for the mrhp task in terms of generalization capacity. nevertheless, there are other various listwise discrimination functions that may prove beneficial for the mrhp model training, for example neuralndcg (pobrotyn and białobrzeski, 2021), listmle (xia et al., 2008), etc. moreover, despite the novelty of our proposed gradient-boosted tree in partitioning product reviews into helpful and unhelpful groups, our method does not employ prior contrastive representation learning, whose objective is also to segregate helpful and unhelpful input reviews. the contrastive technique might discriminate reviews of distinctive helpfulness features to bring further performance gain to multimodal review helpfulness prediction. at the moment, we leave the exploration of different listwise discrimination functions and contrastive learning as our prospective future research direction. secondly, our study can be extended to other problems which involve ranking operations. for instance, in recommendation, there is a need to rank the items according to their appropriateness to present to the customers in a rational order. our gradient-boosted decision tree could divide items into corresponding partitions in order for us to recommend products to the customer from the highly appropriate partition to the less appropriate one. therefore, we will discover the applicability of our proposed architecture in such promising problem domain in our future work."
530,"limitations. first, our method requires additional entity resources, which may be difficult to obtain for certain language pairs. with the development of multilingual entity datasets like paranames (sälevä and lignos, 2022), we are optimistic such resources will be more accessible in the near future. second, as demonstrated in section 5.4, extracting translation candidates increases inference time. due to space limitation, more limitations are discussed in appendix a.6. 15evaluated on a p40 gpu with batch size of 1, other experimental settings same as section 4"
531,"limitations our machine translation experiments revealed that optimal generalization performance is obtained with small interval values. however, r-dangle with small intervals still runs much slower than an equivalent transformer model. despite our modifications, large r-dangle models with small intervals on large datasets remain computationally expensive. in this paper, we only explored a sim- ple periodic re-encoding strategy. however, more complex and flexible ways of re-encoding could be used to further improve computational efficiency. for instance, we could adopt a dynamic strategy which learns when re-encoding is necessary."
532,"limitations in this work, we proposed sstuning for zero-shot text classification tasks. during inference, we may need to design verbalizers even though we can use templates like ""this text is about [label name]"". for simplicity and fair comparison, we only refer to previous works for such designs, which may be sub-optimal. as shown in table 4, using the verbalizers ""terrible."" and ""great."" work better than ""it’s terrible."" and ""it’s great."" for the sst-2 and imda tasks that we reported in the main results. if the labeled validation set is provided, the model may perform better by choosing verbalizers based on the validation set. due to limited computation resources, we only tuned the model with 5.12 million samples, which is only a small portion of the available samples. we believe that tuning the model on a larger dataset help improve the performance. even though the computational cost will also increase, it is worth it since no more training is needed at the inference phase. in addition, we did not do extensive hyperparameter searches except for the learning rate, which may further improve the performance. in our experiment, we only tested the method with discriminative models like roberta and albert. its performance with generative models is not known. it is non-trivial to test on such models since generative models can do both natural language understanding tasks and natural language generation tasks. we leave this as future work."
533,"limitations the limitation of our study is that we only evaluated our model on a limited set of spoken language transcripts. we believe that additional attention should be given to features specific to ad patients, such as pauses and filler words in speech. furthermore, the lack of diversity in the data may also adversely affect the model’s performance on unseen samples. our model would benefit from further testing on a wider range of data, including different languages and different modalities, to see if it is capable of generalizing to other domains in the future."
534,"limitation to this work, which is related to time complexity and speed performance. since every instance is transformed into multiple qa instances, it may take a relatively long time to process a document. 4qualitative analysis is provided in appendix c. limitations there are two primary limitations of the system presented in this work. first, each set of questions we use for training the qa model is designed specifically for the dataset we trained our model on. while we provide a set of questions for each of the two common trc datasets, we believe that training the model on other datasets may require rewrite of the questions. second, as mentioned in the previous section, every trc instance is converted into multiple qa instances which we then process individually. this may increase the overall inference time and pose a practical limitation which needs to be carefully considered."
535,"limitations • we are unable to test the proposed model’s performance on other datasets due to the unavailability of public multi-reference headline generation datasets. • our dataset is created over a period of 6 months and contains around 3000 examples. although there are several commonly used benchmark datasets with a similar number of examples: e.g., r4c reading comprehension dataset (6.4k examples) (inoue et al., 2020), fire-lid (3357 examples), iiithner (3084 examples) datasets in gluecos benchmark (khanuja et al., 2020), wnli (634 examples), rte (2500 examples) and mrpc (3700 examples) datasets in glue benchmark (wang et al., 2018), nope corpus (around 2.7k examples) (parrish et al., 2021), we believe that it will be better to have a larger dataset for this challenging task. we plan to create a larger version of the dataset in future work."
536,"limitations we reflect on the limitations of our model below: 1. our experiments are based on large everyday household datasets (i.e. coin and crosstask). our language model is pretrained with web data, which helps it handle such householdrelated procedures well. however, when applied to other more specialized domains like medical procedures, language models might suffer from the domain gap and impact overall model performance. 2. the language model has excellent planning ability given the ground truth start and goal steps. however, it is still hard for the language model to generate very long sequences of steps. when the planning horizon t increases, the performance of our model drops quickly just as other methods do. 3. in real-world applications (i.e planning task for robots), a good model should be able to dynamically adjust the plan given external feedback. for example, when the execution of one step fails, the model will need to re-plan as soon as possible. our model does not possess such an ability so far, since our planning approach is offline. we leave this direction for future research."
537,"limitations there are several limitations that can be considered for future improvements: (1) in multimodal alignment and fusion, we only consider a single image for each sample, whereas multiple images can be available. a more flexible visual encoding architecture that can digest an indefinite number of input images can improve the visual information coverage; 2) the empirical results in this work focus on three attribute extraction datasets (i.e., item form, color, and pattern) that can clearly benefit from visual perspectives, while there are also various attribute types that rely more on the textual input. different traits of attributes may influence the preferred modalities during the modeling, which is out of scope for this work but serves as a natural extension of this study; 3) currently there is no specific design to improve the efficiency based on the visual question answering architecture. it can be not scalable as the number of attributes increases. there could be a dual-use regarding the attentionpruning mechanism, which can be a potential risk of this work that could arise and harm the result. the attention-pruning mechanism encourages the model to focus on the task-relevant foreground on the given image selected with category supervision, which can improve the prediction precision given the input image is visually rich and contains noisy context background. while for some types of images, such as infographics, there may be helpful text information on the images or intentionally attached by providers. these additional texts may be overlooked by the attention-pruning mechanism, resulting in potential information losses. a possible mitigation strategy is to add an ocr component along with the visual encoder to extract potential text information from given images."
538,"limitations the main target of this paper is to utilize structural knowledge for cross-lingual comprehension. we present a new pre-training task named scp in the hope of bridging the misalignment of structural words in the parallel corpus. more generally, we expect the proposed method can facilitate the research of cross-lingual understanding. admittedly, the main limitation of this work is that we rely on off-the-shelf tools to extract and align words in different languages, which would result in some mistakes at some situations. for example, giza++ only achieves 80%-85% accuracy in aligning the corresponding words in another language. currently, no tech can achieve this goal in 100% accuracy. as a result, some bias data in pre-training calls for further research and consideration when utilizing this work to build xplms."
539,"limitations our work has the following limitations: first, we cannot generalize our"
540,"limitation scaling through the inference corpus. the size of the reference corpus is an additional dimension for model scale in nonparametric models. in this paper, we scale the corpus up to nearly 1b tokens, which is still smaller than the training data of very large language models (brown et al., 2020; rae et al., 2021). we think future work can scale it fur- ther using tools such as distributed faiss (johnson et al., 2019) or scann (guo et al., 2020). significant memory usage. using npm saves gpu compute and memory compared to using models with more parameters. however, npm requires more ram and disk memory due to embeddings of a reference corpus. for instance, the largest corpus in our experiments (full english wikipedia) requires 70gb of ram and 1.4tb of disk memory. future work can build more efficient npm as done in prior work in nearest neighbor search (jegou et al., 2010; norouzi et al., 2012; ge et al., 2014; izacard et al., 2020; yamada et al., 2021). exploration of larger vocabulary. large vocabulary is known to lead performance gains (conneau et al., 2020) but is bounded in memory costs. previous work explored more efficient softmax approximations (morin and bengio, 2005; chen et al., 2016; grave et al., 2017). our nonparametric training offers an alternative by removing the softmax over the vocabulary. with the roberta architecture, increasing the vocab size by 2x makes the baseline training 50% more memory expensive, but does not increase the memory in training npm. however, this paper does not include more systematic evaluation on the effect of large vocabulary. future work can explore training npm with a significantly larger vocabulary to further boost performance. extension for generation. our paper evaluates npm only on prediction tasks. it is currently nontrivial to use npm for generation, since it is the encoder-only model. future work can explore autoregressive generation as done in patel et al. (2022) or use npm for editing (schick et al., 2022; gao et al., 2022). extension to few-shot learning and fine-tuning. our paper focuses on zero-shot evaluation only. future work can extend npm to a few-shot learning setup. in fact, fine-tuning npm is significantly easier than fine-tuning larger models such as t5, opt and gpt-3 which we compare npm with, and can be explored in future work. better cross-lingual transfer. our work explored cross-lingual transfer in a limited setup where the model is trained on monolingual data. we think future work can train multilingual npm, and explore more comprehensive cross-lingual evaluation. in fact, nonparametric training may alleviate the burden of collecting large-scale multilingual corpora since it makes the model less sensitive to the language coverage in the training data, and may lead to significantly better cross-lingual transfer, as we demonstrate in the entity translation task. limitation in speed. we find that search makes inference considerably slower than the counterpart without search. we think that (1) search can significantly be faster with better engineering (we use the default hyperparameters of the faiss index with no tuning) or better index, and (2) the speed of npm is still on par with the speed of significantly larger parametric models that npm outperforms (see table 4). moreover, while not explored in this work, there has been work that improves inference speed (he et al., 2021; alon et al., 2022) that can be applied to npm. we leave improving inference speed to future work."
541,"limitation of the moraldirection is that it is induced on individual words, and thus longer sentences are a significant challenge for the models. still, we were able to test them on parallel subtitles data, which contains slightly longer, but predominantly still short, sentences. problems that showed up repeatedly in this experiment were an over-reliance on key lexical items and a failure to understand compositional phrases, particularly negation. additionally, typical problems of pmlms, such as disambiguation problems across multiple languages, were noticeable within xlm-r. non-english languages appeared more affected by such issues, despite the fact that all our target languages are relatively high resource. (3) moral foundations questionnaire. our experiments with the mfq reinforce the"
542,"limitations in this work we present a novel method based on representation augmentation to solve cross-lingual transfer learning for event detection (ed). although our experiments demonstrate the effectiveness of the proposed method, there are still some limitations that can be improved in future work. first, our current method only leverages sentencelevel context in input document to perform ed over different languages. this might not be optimal as document-level context has been shown to be helpful for ed (pouran ben veyseh et al., 2021b) that can be explored in future research to improve our cross-lingual models. second, the evaluation for our model is limited to only three popular languages (english, chinese, and arabic) that are supported by existing pre-trained language models, unlabeled data, and text processing tools. as such, it is unclear whether the method can be adapted to many other languages with limited access to such resources (e.g., low-resource languages). we believe this is an important direction that can be investigated in future work to advance our understanding for ed models. finally, our method requires joint training with a retrieval model (based on multilingual pre-trained language models) that can impose additional computational costs (as shown in table 3). reducing necessary computational costs for our model is an important direction to make it more accessible for different applications and domains."
543,"limitations to better enlighten the follow-up research, we conclude the limitations of our method as follows: 1) although the method we proposed can help improve the quality of generated labels, there is still room for further improvement; 2) because our detection is not perfect, it will lead to inaccurate labels of some samples. we look forward to better methods to improve detection in the future; 3) this work has verified that the extended labels can effectively help the performance of models and proposed a method of label extension, but has not tried other extension methods or whether it is helpful to extend more labels. 4) this work focuses on solving open environment intent prediction with different generative models, without exploring other types of models."
544,"limitations our approaches mainly leverage a fixed feature extractor together with a set of individually trained classifiers to mitigate catastrophic forgetting whereas a tunable feature extractor may also be helpful and complement the individually trained classifiers, so a future direction is to design advanced strategies to efficiently tune the feature extractor in combination with our proposed ice based classifiers. in addition, we mainly investigate the classifier drift and demonstrate the effectiveness of our solutions under the class-incremental continual learning setting. another future direction is to explore similar ideas under other continual learning settings, e.g., task-incremental learning, online learning, or the setting where new sessions also contain annotations for old classes."
545,"limitations in each contribution of this work, we can isolate several potential limitations. in creating c-xnli, the mt model for the formation of the train set was chosen based on the results from a single dataset. additionally, an assumption that the model is plagued with typical issues that affect mt models was investigated on a small dataset. although we are skeptical of the mt model’s performance and perform qe scoring of the small dataset by a group of annotators and analysis to ascertain its performance, we are only comparing croatian machinetranslation results to results from a single language (german), assuming that results would hold for other high-resource languages. also, for some mt evaluations, we use a single metric (bleu) known to have many problems but only generally considered to correlate with human judgment. our hyperparameter optimizations are of limited scope. all hyperparameters are fixed, except the learning rate with four possible values we search over. furthermore, we only used three seeds. we could not perfectly reproduce the results outlined in the paper of our baseline xlm-r base model, partly due to a lack of elucidation in the original 4cc by-nc 4.0 5https://github.com/lobadic/c-xnli paper and partly due to limited hyperparameter optimizations. finally, we do not elucidate further and experiment with the discovered correlation between the models’ performance and the overlap in datasets, and we leave it for future work."
546,"limitations, resulting in a reduced impact on the environment. we finetuned nine models on program and function translation tasks and due to the smaller size of the training data, all jobs took a total of 1–2 days on rtx 2080 ti gpus. a total of 100 hours of training in a single rtx 2080 ti gpu results in approximately 7.5kg of carbon emission into the environment.10 sensitive information avatar composed of parallel programs and functions that do not have any natural language (nl) comments or docstring. we remove them to get rid of any personally identifiable information or offensive content. however, there could still be such content in the form of string as we do not manually check each example."
547,"limitations our study revealed considerable differences in transferability and other measures we considered across different datasets. nonetheless, the study focused on the differences in transferability arising from the choice of the models and the al methods rather than the dataset. to eliminate confounding due to datasets, we grouped the results by datasets and analyzed each group separately. despite this, the scope of our results is limited by the fact that all datasets used are in english and possibly contain their own biases. even though we showed that it could still be useful to transfer actively acquired datasets between transformer-based plms, it is important to keep in mind that actively acquired datasets are not representative of the original data distribution due to the sampling bias introduced by active learning."
548,"limitations regarding our work, a few limitations should be mentioned. during the annotation process, conflicts between annotations occurred. all conflicts were discussed with a senior researcher and resolved in this way. thus, we reached the best possible agreements, but still some agreements are lower than others (see table 2). for example, legal claims and premises have a relatively large room for interpretation. perfect results can only be expected by over-anchoring the annotators and weakening the guideline, which we have consciously avoided in our research. the comparison of the iaa with other works in the field of nlp from legal science is not possible, because the works either do not examine the components of the appraisal style or identify the components of the judgment style without the indication of the iaas (urchs et al., 2020). compared to works that also annotated premises (kripp. α = 51.08%) and claims (kripp. α = 55.49%) in business pitches (wambsganss and niklaus, 2022), our work provides comparable results with respect to the agreement of the krippendorff α (premise = 55.89%, legal claim = 45.02%). further work shows similar results α = 44.1% (park and cardie, 2018). all in all, we can assume that both our components and our mounted relationships, achieve comparable or better results than comparable works (e.g., park and cardie (2018)). although our model shows accurate values between 78% and 92% for predicting the components of the appraisal style, the values for determining legal claims and premises are lower (62% and 78%) compared to the other values. however, they display reasonable values when compared to previous nlp studies. we can only compare our work to other related work in another domain because values for detecting legal claims and premises are not available in the nlp literature. for instance wambsganss and niklaus (2022), present an accuracy of 54.12% for their long short-term memory (lstm) model which detects claims and premises. with the mentioned model the authors shows positive outcomes in supporting students’ argumentative skills. our models show similar or higher precision in comparison to the works of poudyal et al. (2020) or wambsganss and niklaus (2022) (see table 7 in the appendix a) and our post-test results also show significant learning outcomes (see table 11 in the appendix a). although we can show a significant learning output, it must be noted that this is only short term. as a result, we intend to carry out additional field experiments in the future to establish the system’s effectiveness over a more extended period and demonstrate long-term success. as a third possible limitation, our models are limited to applying the appraisal style in german only. in the future, further efforts have to be made to investigate the transfer-ability or adaptation of our models to other countries with other legal systems and other languages. however, we assume that this is possible in principle, since some countries such as china now use the appraisal style in law teaching (man, 2022) and countries such as the u.s. use at least similar approaches such as learning with case studies using the irac formula (metzler, 2002). nevertheless, some adaptation of the models is needed, since the language and the legal form in each country have their own specificities."
549,"limitations we build a new benchmark for syllogistic reasoning. the limitations are mainly in the experiments part: (1) due to the limited human resources, our test set is quite small, which may not support training large models directly. (2) we evaluate all models by comparing their predictions with the groundtruth"
550,"limitations more work is needed to uncover the causes of the inconsistent performance across randomly initialized models in experiment 1. although the bias toward forward function application implemented in experiment 2 was effective in our experiments, it is unlikely to work as a general-purpose method, since languages vary in their branching characteristics and in the contexts in which they apply forward and backward function application."
551,"limitations in our current experiments, prompt-based methods are primarily storage-efficient or parameterefficient solutions. since these methods all require backpropagation to the bottom layer, the training time of prompt-based methods are closely resembles that of traditional fine-tuning approach."
